{
  "schema_version": "1.0.0",
  "record_type": "config",
  "record_kind": "live",
  "repository_url": "https://github.com/kamil-kazmierczak/java-learning",
  "branch": "develop",
  "entry_file": "AGENTS.md",
  "workflow_path": ".github/workflows/validate.yml",
  "required_checks": [
    "validate-data",
    "validate-language"
  ]
}
